{
  "schema_version": "manifest.v1",
  "algorithm": "sha256",
  "canonicalization": "UTF-8 LF bytes; POSIX paths sorted lexicographically",
  "files": [
    "README.md",
    "architecture.md",
    "contract-requirements.md",
    "threat-model.md",
    "trust-boundaries.md",
    "control-catalog.md",
    "data-flow.md",
    "risk-register.md",
    "opportunity-register.md",
    "pilot-and-adoption-gates.md",
    "standards-register.md",
    "contracts/README.md",
    "contracts/mission.v1.json",
    "contracts/lease.v1.json",
    "contracts/effect.v1.json",
    "contracts/attestation.v1.json",
    "contracts/evidence.v1.json",
    "contracts/revocation.v1.json",
    "contracts/recovery.v1.json",
    "contracts/review.v1.json",
    "contracts/reviewer.v1.json",
    "contracts/manifest.v1.json",
    "fixtures/cases.json",
    "validate_enclave.py",
    "freeze_manifest.py",
    "independent-review-handoff.md"
  ],
  "package_hash": "f58662665471adcbed48e276103671f62709c2d3261b24ce194c6594e1cfc3d1"
}
